{
  "adapter_name": "yolo26n_visdrone_scratch",
  "baseline_id": "yolo26n_visdrone_scratch_exp000_s2_80ep",
  "generated_at": "2026-09-07T20:34:44+00:00",
  "data": {
    "primary_metric": {
      "name": "mAP50",
      "value": 0.27042323289949954,
      "seeds": [
        42,
        123,
        7
      ],
      "spread": 0.004967419437789278
    },
    "per_class_metric": [
      {
        "class_name": "bicycle",
        "value": 0.06778212977441715
      },
      {
        "class_name": "awning-tricycle",
        "value": 0.11527229354141251
      },
      {
        "class_name": "tricycle",
        "value": 0.15512729864970132
      },
      {
        "class_name": "people",
        "value": 0.20098962468240614
      },
      {
        "class_name": "truck",
        "value": 0.24824831847740475
      },
      {
        "class_name": "pedestrian",
        "value": 0.2642164618757332
      },
      {
        "class_name": "motor",
        "value": 0.27394422016109843
      },
      {
        "class_name": "van",
        "value": 0.2895374240526881
      },
      {
        "class_name": "bus",
        "value": 0.43482992896372075
      },
      {
        "class_name": "car",
        "value": 0.6827861990724015
      }
    ],
    "per_scale_metric": {
      "small_recall": 0.22882089301628716,
      "medium_recall": 0.5983434968599254,
      "large_recall": 0.731665228645384
    },
    "top_failure_units": [
      {
        "unit_id": "0000078_01314_d_0000004.jpg",
        "value": 0.0
      },
      {
        "unit_id": "0000078_06777_d_0000020.jpg",
        "value": 0.0
      },
      {
        "unit_id": "9999938_00000_d_0000069.jpg",
        "value": 0.0
      },
      {
        "unit_id": "9999938_00000_d_0000077.jpg",
        "value": 0.0
      },
      {
        "unit_id": "9999938_00000_d_0000116.jpg",
        "value": 0.0
      },
      {
        "unit_id": "9999938_00000_d_0000148.jpg",
        "value": 0.0
      },
      {
        "unit_id": "9999938_00000_d_0000247.jpg",
        "value": 0.0
      },
      {
        "unit_id": "9999938_00000_d_0000505.jpg",
        "value": 0.0
      },
      {
        "unit_id": "9999941_00000_d_0000022.jpg",
        "value": 0.0
      },
      {
        "unit_id": "9999952_00000_d_0000027.jpg",
        "value": 0.0
      },
      {
        "unit_id": "9999952_00000_d_0000028.jpg",
        "value": 0.0
      },
      {
        "unit_id": "9999952_00000_d_0000257.jpg",
        "value": 0.0
      },
      {
        "unit_id": "9999952_00000_d_0000259.jpg",
        "value": 0.0
      },
      {
        "unit_id": "9999952_00000_d_0000278.jpg",
        "value": 0.0
      },
      {
        "unit_id": "9999952_00000_d_0000325.jpg",
        "value": 0.0
      },
      {
        "unit_id": "9999976_00000_d_0000002.jpg",
        "value": 0.0
      },
      {
        "unit_id": "9999976_00000_d_0000029.jpg",
        "value": 0.0
      },
      {
        "unit_id": "9999976_00000_d_0000030.jpg",
        "value": 0.0
      },
      {
        "unit_id": "9999976_00000_d_0000031.jpg",
        "value": 0.0
      },
      {
        "unit_id": "9999976_00000_d_0000033.jpg",
        "value": 0.0
      }
    ],
    "model_topology_summary": {
      "params_M": 2.5077,
      "fused_params": 2376786,
      "gflops": 5.2,
      "head_strides": [
        8,
        16,
        32
      ],
      "note": "end2end NMS-free Detect, reg_max=1, C2PSA at backbone tail; P2 (stride 4, idx 2) not fused into head"
    },
    "diagnostic_source": {
      "seed": 123,
      "weights": "/home/vishalkagade/vishal/autovidyav5/runs_visdrone/exp000_S2_seed123/weights/last.pt",
      "per_unit_metric": "per-image F1 @ IoU .5, conf .25 (2,158 units)",
      "per_scale_metric": "detection RECALL by COCO area bucket (native px), NOT AP-by-scale"
    },
    "per_unit_summary": {
      "42": {
        "mean_f1": 0.479217212096281,
        "degenerate_frac": 0.015291936978683966,
        "f1_zero_frac": 0.012048192771084338
      },
      "123": {
        "mean_f1": 0.4805369663574924,
        "degenerate_frac": 0.016682113067655237,
        "f1_zero_frac": 0.014365152919369786
      },
      "7": {
        "mean_f1": 0.4766594806938723,
        "degenerate_frac": 0.015755329008341055,
        "f1_zero_frac": 0.012974976830398516
      }
    },
    "instrument_check": {
      "degeneracy_by_seed": {
        "42": 0.015291936978683966,
        "123": 0.016682113067655237,
        "7": 0.015755329008341055
      },
      "degeneracy_pass": true,
      "relative_noise_floor": 0.018369055737290797,
      "relative_floor_pass": true,
      "instrument_pass": true
    }
  },
  "analysis": {
    "summary": "From-scratch YOLO26n at 80 epochs reaches mAP50 0.270 (seed spread 0.005, relative floor 0.018) on the frozen 2,158-image eval. Instrument check PASSED (degeneracy 1.5-1.7%, relative floor 0.018). Three measured failure structures: (1) small GT (68% of boxes) is mostly missed - recall 0.23 vs 0.73 for large; (2) per-image F1 collapses with scene density, confounded with (1); (3) when objects ARE located, sibling classes are swapped at high rates (van->car 58%, bicycle->motor 57%), plus 15% background false positives. Class frequency explains the per-class AP spread only moderately (Spearman 0.58); scale and sibling confusion explain more. Learning curve: val500 mAP50 0.288 at epoch 80, 0.296 at 150-200 - the 80-epoch budget sits at 97% of the 200-epoch plateau by the pre-registered rule.",
    "candidate_failure_modes": [
      {
        "id": "fm_small_gt_missed",
        "label": "Small ground-truth boxes are mostly missed",
        "description": "68% of frozen-eval GT is COCO-small (<32^2 px native; median 22 px side). The model recovers 23% of them vs 60% medium / 73% large. Per-image F1 rises monotonically with the image's median GT area (0.31 for <200 px^2 to 0.62 for >3000 px^2). The person-like classes (pedestrian, people, motor, bicycle: 79-86% missed at conf .25, median area 180-420 px^2, i.e. 5-8 px at the 640 input) carry most of the loss. Architecture fact: the finest head output is stride 8 (8-px cells at 640); the stride-4 P2 feature (model.model[2]) is computed but never fused into the head.",
        "evidence": "per_scale_metric: small_recall=0.229, medium_recall=0.598, large_recall=0.732; F1-by-median-GT-area buckets 0.307/0.418/0.513/0.560/0.615; per-class missed@conf.25: pedestrian 0.79, people 0.86, bicycle 0.86, motor 0.78 vs car 0.35 (seed 123 diagnostics)",
        "evidence_unit_ids": [
          "9999938_00000_d_0000247.jpg",
          "9999938_00000_d_0000148.jpg",
          "9999976_00000_d_0000002.jpg",
          "9999941_00000_d_0000022.jpg"
        ],
        "suggested_intervention_modes": [
          "topology: a stride-4 evidence path into the head",
          "site_wrap@head.c3k2_out_p3 / backbone.c3k2_p2"
        ]
      },
      {
        "id": "fm_dense_scene_f1_collapse",
        "label": "Per-image F1 collapses as the scene gets denser",
        "description": "Mean per-image F1 falls monotonically with GT count: 0.55 (<20 boxes) -> 0.49 -> 0.46 -> 0.41 -> 0.28 (>=200 boxes). Eval images average 52.8 boxes (max 461). The 20 worst units are dominated by pedestrian crowds (e.g. 124 pedestrians at 18 px^2 median). Confounded with fm_small_gt_missed (dense scenes are also small-object scenes) - a proposal citing this fm must say which half it targets. Architecture fact: the NMS-free one-to-one head emits at most max_det=300 boxes and still produces 8.7% duplicate predictions at conf .25.",
        "evidence": "F1-by-GT-count buckets 0.550/0.490/0.455/0.405/0.278 (n=450/836/633/201/38); top20_failure_units all F1=0, 12/20 pedestrian-dominated; duplicates 5,254 of 60,479 predictions (seed 123)",
        "evidence_unit_ids": [
          "9999938_00000_d_0000247.jpg",
          "9999938_00000_d_0000077.jpg",
          "9999938_00000_d_0000069.jpg"
        ],
        "suggested_intervention_modes": [
          "head.detect (one-to-one assignment / decision layer)",
          "backbone.c2psa (global context under crowding)"
        ]
      },
      {
        "id": "fm_sibling_class_confusion",
        "label": "Located objects get the sibling class",
        "description": "When a box IS found (IoU>=.5), the class is often the visually-similar sibling: van->car 58% of located vans (2,627/4,527); bicycle->motor 57% (213/373); awning-tricycle wrong 75% (202/270); people->pedestrian 25% (416/1,663); truck->car/bus 45%; bus->truck 27%. Class errors, not localization errors: the objects' extents are recovered. Pure background false positives are a further 15.4% of predictions (car 4,422; pedestrian 2,880). Per-class AP50 correlates only moderately with train frequency (Spearman 0.58): van (25k train) scores 0.29 while bus (5.9k) scores 0.44; bicycle (10k) 0.07 vs motor (30k) 0.27 - sibling confusion and scale explain more of the spread than frequency.",
        "evidence": "confusion at conf .25 IoU .5, seed 123: van located 4,527 / correct 1,720; bicycle 373/79; awning-tricycle 270/68; people 1,663/1,081; truck 1,314/717; bus 1,477/1,084; pure FP 9,322/60,479; per_class_ap50 van 0.290, bus 0.435, bicycle 0.068, motor 0.274",
        "suggested_intervention_modes": [
          "head.detect cls branch / decision-theoretic objectives",
          "head.c3k2_out_p4 (van/car/truck live at stride 16)"
        ]
      }
    ],
    "gaps": [
      "loss_decomposition (adapter raises NotImplementedError)",
      "per_site_recall_contribution (not implemented)",
      "AP-by-scale (only recall-by-scale available)"
    ]
  }
}